{
  "$schema": "http://json-schema.org/draft-07/schema#",
  "$id": "https://vilnacrm.org/schemas/browser-support.schema.json",
  "title": "Browser support policy",
  "description": "Authoritative declaration of the browser matrix the production build promises to run on (issue #153). The browserslist production query, the polyfill decision, and the README matrix are all reconciled against this file by `make check-browser-support`.",
  "type": "object",
  "additionalProperties": false,
  "required": ["polyfill", "baseline", "queries", "families", "readmeSection"],
  "properties": {
    "polyfill": {
      "description": "RSBuild `output.polyfill` mode the production build must declare.",
      "enum": ["off", "usage", "entry"]
    },
    "baseline": {
      "description": "Human-readable name of the interoperability line the floors were chosen from.",
      "type": "string",
      "minLength": 1
    },
    "queries": {
      "description": "Exact, ordered `browserslist.production` query list in package.json.",
      "type": "array",
      "minItems": 1,
      "uniqueItems": true,
      "items": { "type": "string", "minLength": 1 }
    },
    "families": {
      "description": "Browserslist family id to the floor the resolution must produce.",
      "type": "object",
      "minProperties": 1,
      "additionalProperties": {
        "type": "object",
        "additionalProperties": false,
        "required": ["label"],
        "properties": {
          "label": { "type": "string", "minLength": 1 },
          "floor": {
            "description": "Lowest supported version. Required unless the family is latest-only.",
            "type": "string",
            "pattern": "^[0-9]+(\\.[0-9]+)*$"
          },
          "trackLatest": {
            "description": "Browserslist tracks a single always-current version for this family, so no floor can be pinned.",
            "const": true
          }
        },
        "oneOf": [{ "required": ["floor"] }, { "required": ["trackLatest"] }]
      }
    },
    "readmeSection": {
      "description": "README heading whose table must list every family and floor.",
      "type": "string",
      "minLength": 1
    }
  }
}
